Datetime,Tweet Id,Text,Username
2022-10-13 19:23:18+00:00,1580640340020985857,"$MMTLP should be restored on WSB! 

I wonder if the mods banned it temporarily so they can load up at a discount before restoring $MMTLP's meme stock privileges.",wallstreetbets
2022-10-13 19:16:47+00:00,1580638699775090688,"@MMATNEWS @Official_WSB I haven't been running that pony show for some time now. You'll have to make your appeal with the usurpers.

But I support your request $MMTLP to the moon 🌛",wallstreetbets
2022-10-13 16:54:52+00:00,1580602984316424192,"I only have two words: event contract

Remember them",wallstreetbets
2022-10-13 01:06:09+00:00,1580364231874007040,"@Tradingnoob8 I can play your silly game. Proper English syntax for ending sentences in quotations leaves the period inside the quotation.

Example: They think there is a word call [sic] ""Inmutable.""",wallstreetbets
2022-10-13 00:55:40+00:00,1580361596500463617,"The difference between these brand new hardware wallets is that one is an inmutable fortress for crypto storage, shielded by sophisticated elliptic curve based math and out of reach from the most sophisticated adversary.

The other one, however, is missing the plastic wrapper https://t.co/8xELMFP8YL",wallstreetbets
2022-10-12 21:24:44+00:00,1580308512462118912,"Come for the open bar, stay for the surprises... @web3expo https://t.co/PAa57pXOr4",wallstreetbets
2022-10-12 18:06:00+00:00,1580258499887452160,"Open bar, gourmet hors d'oeuvres and a few surprises will be at the WBJ Happy Hour at @WynnLasVegas from 3-5p. If you're at @web3expo, make sure to come through. https://t.co/h41hXL772L",wallstreetbets
2022-10-12 15:25:13+00:00,1580218034555588609,Looking forward to meeting some of you guys IRL at today’s WSB Happy Hour party at the @wynnlasvegas from 3-5p. There’ll be good booze and even better conversation. Use code WSB33 when purchasing your @web3expo pass for access to the party and 33% off. https://t.co/TFypzL7gFw,wallstreetbets
2022-10-12 05:39:04+00:00,1580070528122990592,"Pop quiz: you're walking past a roulette table and see this. What do you do?

1) bet it all on red
2) doesn't fucking matter. It's still ~50/50
3) keep walking - stock market opens in 8 hrs and it's more fun
4) fuck waiting for stocks. crypto trades 24/7 https://t.co/pO7AlD2KAh",wallstreetbets
2022-10-12 03:43:20+00:00,1580041402162958336,Had an incredible conversation with Christopher (CEO of @AP4Less). Fascinating story and promising road ahead. Keep an eye on these guys - disruption is in his DNA. https://t.co/MAgrw09LXV,wallstreetbets
2022-10-12 03:29:54+00:00,1580038021356716033,This is where it's at tomorrow at 3pm (at the Wynn) https://t.co/qmyAKtvN0y,wallstreetbets
2022-10-11 19:27:42+00:00,1579916672064188416,"@dgroenig01 OK I feel bad now it was a joke. Sorry.

But you should swing by the Wynn tomorrow at 3pm I'm hosting an happy hour. Free drinks and quality food.",wallstreetbets
2022-10-11 19:21:39+00:00,1579915147157835777,@dgroenig01 I got a junior suite at the Tropicana. You're missing out.,wallstreetbets
2022-10-11 19:17:55+00:00,1579914207315005442,"I'm glad Alexa in hotels wasn't a thing growing up.

I'd run down the halls at 3am yelling ""Alexa, lights on 100%, open curtains and play welcome to the jungle max volume""",wallstreetbets
2022-10-11 18:17:13+00:00,1579898933035225089,Reminds me of Terra / Luna https://t.co/ngSzf6za8e,wallstreetbets
2022-10-11 16:07:14+00:00,1579866220379004930,"Excited to talk all things Web3 at tomorrow’s WSB Happy Hour at the @wynnlasvegas from 3-5p. If you still need a @web3expo pass, use code WSB33 for 33% off and access to my party. https://t.co/TFypzLojHw

How long until Web3 goes mainstream?",wallstreetbets
2022-10-11 14:05:07+00:00,1579835488399396865,To be fair he gave me outright permission to fuck with him. https://t.co/I01DztfSvj,wallstreetbets
2022-10-11 13:51:42+00:00,1579832114123800576,"Which reminds me, I'll be doing this again so if you see me giving away free money - know it's real. https://t.co/ZEMSk2HWB9",wallstreetbets
2022-10-11 13:21:50+00:00,1579824597763227652,"Boarding flight to Las Vegas.

Reminder: happy hour tomorrow at 3pm @ Musigny room at the Wynn. Open bar, gourmet hors d'oeuvres and a few surprises.

Open to ticket holders to https://t.co/vS0V85wCCb (use discount code WSB33 for big discount).",wallstreetbets
2022-10-11 13:14:12+00:00,1579822675631177729,"USTC is my favorite stablecoin for technical analysis.

Aside from high beta (ie volatility - up like 30% today) it has a beautiful trending price channel, respecting support/resistance. https://t.co/jBxgtM237J",wallstreetbets
2022-10-08 12:34:36+00:00,1578725547865038848,"Pumped for @web3expo next week at the @WynnLasVegas on 10/10 - 10/13. Use code WSB33 for 33% off all pass types. Use my code and you'll get access to our awesome WSB Happy Hour on 10/12 from 3-5p. Get your pass here:
https://t.co/TFypzLojHw",wallstreetbets
2022-10-07 03:00:18+00:00,1578218633326563328,price analysis starts around 30 minutes in,wallstreetbets
2022-10-07 02:56:06+00:00,1578217574256345088,"BREAKING: Turmoil in Crypto (from earlier spaces, with video supplement)

https://t.co/snknV2XK53",wallstreetbets
2022-10-07 02:23:30+00:00,1578209372382953472,"To anyone who watched the video without audio (or vice versa) I apologize, we tried an ad-hoc screen sharing solution to spaces and it was sloppy.

I'm uploading a video on youtube with both the audio and video.  Will be up shortly. https://t.co/daJiw9wkfr",wallstreetbets
2022-10-06 22:14:19+00:00,1578146660676521984,https://t.co/iI0KgtyNuN,wallstreetbets
2022-10-06 16:33:12+00:00,1578060815642628098,Today I Learned that tiktok is with over $300B,wallstreetbets
2022-10-06 15:00:52+00:00,1578037579521343488,So... to the moon? The good thing about finance is that you can always find something that only goes up. https://t.co/Y6SVDL5iO0,wallstreetbets
2022-10-06 02:30:08+00:00,1577848652957196288,Netflix needs a setting to hide programs with weekly episodes until the complete season is out. Then plop it on the new releases.,wallstreetbets
2022-10-06 02:21:36+00:00,1577846505687457794,"@Section_230 I agree 100% but unfortunately I'm not referring to that (ie. liability protections against publishers or speakers of third party content).

I'm talking about platforms who take things too far and become sloppy.",wallstreetbets
2022-10-06 00:32:35+00:00,1577819069830635521,The biggest threat to companies who shield themselves behind section 230 is that the seemingly impenetrable protection it affords has lead to complacency.,wallstreetbets
2022-10-05 18:21:01+00:00,1577725562524553217,I'm officially bullish all of the crypto.,wallstreetbets
2022-10-05 16:08:22+00:00,1577692179199188992,Hey @Fidelity what ever happened to the Reddit IPO?,wallstreetbets
2022-10-05 07:14:39+00:00,1577557865778266113,@TheStalwart @NathanTankus Best you stay away from crypto then. Not even Sundays will save you.,wallstreetbets
2022-10-05 07:08:33+00:00,1577556331694678016,"What we really need is an index for ""USD World Currency Reserve Status."" A drop in that would make @zerohedge look optimistic.

This chart is unreal considering everything that's happening today. https://t.co/2he3ZoeaSD",wallstreetbets
2022-10-05 06:45:34+00:00,1577550548567351296,"@thebookout14 I'm not defending debt but if we're playing ratio obfuscation I could plot a debt/gdp or inflation adjusted,  log scale, etc...

I went to great lengths to find charts which were just 1) absolute number 2) linear scale, and no fancy pants analysis. Apples and apples.",wallstreetbets
2022-10-05 06:01:58+00:00,1577539572862361601,i thought debt was a good thing when inflation sky high https://t.co/GeWym2LszY,wallstreetbets
2022-10-05 06:00:35+00:00,1577539227847254016,"I could go on but I've made my point (I hope). 

This party will last as long as the USD can hold onto its currency reserve status, otherwise the music stops and then the #WNGMI party begins.",wallstreetbets
2022-10-05 06:00:35+00:00,1577539225758486528,world population https://t.co/OZp2XnHN4X,wallstreetbets
2022-10-05 06:00:34+00:00,1577539221895536640,And the GDP https://t.co/HcpGh2Rhpy,wallstreetbets
2022-10-05 06:00:33+00:00,1577539217705402368,Sorta like the stock market. https://t.co/pdc0YJCQms,wallstreetbets
2022-10-05 06:00:32+00:00,1577539213330817025,"Perhaps $31T is a milestone

But the statement ""today we have the highest debt ever on record in history eternity omg"" has been repeated every day since the beginning. https://t.co/xAdjEmE5Om https://t.co/q0ieGGfum2",wallstreetbets
2022-10-04 23:11:41+00:00,1577436322330865664,Remember the dollar store? Me neither.,wallstreetbets
2022-10-04 02:49:24+00:00,1577128725195689984,@zerohedge Or in less sensational terms: this happens on average every 7 years.,wallstreetbets
2022-10-01 22:13:44+00:00,1576334576288690177,"If you use WhatsApp and don't have 2 factor authentication, you should enable it. Everyone around me is dropping like flies (without them clicking links / forwarding calls etc).",wallstreetbets
2022-10-01 18:53:10+00:00,1576284102629945344,"en la llamada me dieron muchos datos personales (mucho más que el nombre/cumpleaños) de otra persona para ""prevenir fraude""

con esta grabación comienzo mi nueva serie documentando mi aventura para quitar mi teléfono de su sistema.

enjoy.",wallstreetbets
2022-10-01 18:53:09+00:00,1576284099387412481,"@SantanderMx llevo 5 años me llaman por error, ofreciendome cambios y promociones a la cuenta de otra persona.

Si les digo que tienen mal el numero (ni soy cliente de utds), me ignoran o cuelgan. Si les digo que soy quien buscan, me permiten aceptar y hacer cambios a la cuenta https://t.co/HcaFewFfTt",wallstreetbets
2022-09-30 21:43:33+00:00,1575964594329120768,@woahtheredontg1 well party would be in two weeks (Oct 12) so maybe just in time.  I'll post more details in the coming days,wallstreetbets
2022-09-30 21:25:47+00:00,1575960120655171584,Who's up for a party in Vegas?,wallstreetbets
2022-09-29 00:47:31+00:00,1575286113572253697,"Conventional investing wisdom is dead:

- Stocks and bonds are now correlated.

- Inflation and Gold are now inverse correlated.

Please just point me to the nearest jpeg hub so I can get my sanity back.",wallstreetbets
2022-09-28 23:37:26+00:00,1575268477530669059,"I'm now able to BinTweet.

Whatever that means.

https://t.co/G38CvzBobi",wallstreetbets
2022-09-28 22:06:31+00:00,1575245597849751552,"I mistakenly clicked on the ""Forums"" tab in gmail today and was able to find confirmations to all the payments I never made.

I wonder what's in my spam folder. https://t.co/ezPD2Iec2V",wallstreetbets
2022-09-26 13:23:35+00:00,1574389220159868929,"Love him or hate him, Trump on Twitter is only second to Musk. https://t.co/QqSX8MqEHj",wallstreetbets
2022-09-26 11:56:42+00:00,1574367353961418752,The world's biggest stablecoin https://t.co/2KEzEJKuk5,wallstreetbets
2022-09-21 06:01:30+00:00,1572466026398486528,"Reminds me of this clip.

SEC secures jurisdiction over ETH... through the use of a press release. https://t.co/ASuPxuoI8W https://t.co/HjDYFfnoni",wallstreetbets
2022-09-20 16:30:17+00:00,1572261877769703426,Is there a predictit market for betting on earthquakes on September 19th?,wallstreetbets
2022-09-20 00:36:31+00:00,1572021854000365568,"It's a feature, not a bug.

@SkyAlert app fails to warn Mexicans that a magnitude 7.7 quake was about to hit because they disabled it for anual ""earthquake drill"" which took place an hour before the real one.

September 19th quakes are common &amp; historically the deadliest here. https://t.co/Rdll8TIPMa",wallstreetbets
2022-09-19 18:12:13+00:00,1571925140430098432,Estadísticamente imposible. Septiembre 19. Otra vez. Simulacro y terremoto.,wallstreetbets
2022-09-16 19:49:46+00:00,1570862527088828416,"Advice to entrepreneurs:  stop thinking, get off your ass and go make some mistakes today.  You'll thank me later.",wallstreetbets
2022-09-16 01:27:20+00:00,1570585091587608577,"I owe an apology to HBO. Although they haven't yet resolved my streaming woes, they've been an extremely good spirit while trying to help.  

I'm sorry for my tantrum @hbomax and thanks for your help. You deserve better. https://t.co/4ILgDTblEi",wallstreetbets
2022-09-15 22:56:33+00:00,1570547145585078273,"In times of war is it better to fire a warning shot and give opponent chance to surrender?

Or is it better to enact years of planning and surprise your opponent with a blitz...",wallstreetbets
2022-09-15 13:50:18+00:00,1570409679075049472,@juanher39282802 https://t.co/86f32k73Z5,wallstreetbets
2022-09-15 12:38:44+00:00,1570391666875564034,@chigrl i can't explain why but i trust traders who don't use gridlines on charts.,wallstreetbets
2022-09-15 12:32:51+00:00,1570390185074098177,This is one of those warnings I actually care about https://t.co/lj8COhhRNk,wallstreetbets
2022-09-14 13:39:22+00:00,1570044538089279488,"@NathanielParish i'm a part of this statistic/demographic.  One dollar spent in the US buys you a third of what its peso equivallent can in Mexico. 

It's apparent with most consumer goods, pretty apparent with housing / transportation, food , and extremely apparent with services.",wallstreetbets
2022-09-13 12:39:52+00:00,1569667175027204098,"Q: whats the point of so many cryptocoins if they all move up and down together?

A: impulse control. If it takes 20 mins to close/open all your positions, you'll think long and hard before doing so.",wallstreetbets
2022-09-12 18:54:41+00:00,1569399113396981760,Product branding $AMC $APE https://t.co/t8YXyd4dTq,wallstreetbets
2022-09-10 18:15:35+00:00,1568664497069465601,AMC's CEO Adam Aron is revolutionizing finance from the top down. Retail from the bottom up. They'll meet in the middle somewhere. https://t.co/rjqLgewjwp,wallstreetbets
2022-09-01 21:48:32+00:00,1565456600302641152,Responsible financial planning https://t.co/f0ELHlHwZd,wallstreetbets
2022-09-01 00:51:59+00:00,1565140377421627392,"@ragzyart Sure, I'll byte https://t.co/5xcjCxTGyO",wallstreetbets
2022-08-31 16:59:33+00:00,1565021487169507328,Just hit ctrl+z or reverse the transaction. No biggie. https://t.co/KCFRfyvswD,wallstreetbets
2022-08-29 22:50:34+00:00,1564385044214321152,@cz_binance getting a lot of complaints are we?,wallstreetbets
2022-08-29 22:49:43+00:00,1564384831512854528,"@Breaking911 I love how trump can still proxy-tweet screenshots (checkmark and all) and get like 4k retweets from just this one account despite being banned on twitter.  excellent workaround.

your move @Twitter",wallstreetbets
2022-08-29 01:26:20+00:00,1564061856347693056,"The secret to not knowing the answer on live TV is to own it!

For this and more check out https://t.co/XGn0ymow8q https://t.co/YEqM6VQ6uV",wallstreetbets
2022-08-29 01:22:25+00:00,1564060871986487296,@juanher39282802 I'll be sharing my thoughts on them but they don't fit in a 200 or whatever character tweet. I'll probably post a video on YouTube because I have a lot to say about it.,wallstreetbets
2022-08-29 00:40:11+00:00,1564050245239152642,"After AMC surprised everyone with the $APE airdrop, I was left with profound thoughts but I'm curious of yours. What do you think?",wallstreetbets
2022-08-26 04:40:33+00:00,1563023570002796545,"@BearDaddy069 @hbomax I have no issues with netflix, disney, amazon or apple.  just hbo. https://t.co/XwbRCdMwO3",wallstreetbets
2022-08-26 02:23:37+00:00,1562989111715041281,"Dear @hbomax I'm happy paying you for my subscription because your content is great.

But 9/10 times I end up pirating your shows  because your streaming capabilities make dialup modems look good.",wallstreetbets
2022-08-24 17:31:58+00:00,1562492929498763269,"Let's make a deal. I'll loan you money and you have to pay it back later with interest but with one condition though: if you don't want to pay me back then you don't have to 

I'll just recover the money by raising rates",wallstreetbets
2022-08-24 17:12:04+00:00,1562487921197756418,If you think about it that's all that SPACS are: shares that can go up or down,wallstreetbets
2022-08-24 17:12:04+00:00,1562487919620661255,AMC should just drop out of the movie business altogether and focus on maintaining their special meme-stock status.,wallstreetbets
2022-08-21 01:55:11+00:00,1561170015298019328,@thehill Yes but now show me a picture of the suspect they arrested,wallstreetbets
2022-08-17 21:31:18+00:00,1560016443768311808,"The recent resurgence in retail-trading favorites won’t let up anytime soon, says Jaime Rogozinski, founder of the popular chat forum WallStreetBets https://t.co/j2eC02jSun via @markets",wallstreetbets
2022-08-17 12:59:02+00:00,1559887527707922436,"Dear @RobinhoodApp please don't disable the buy button this time. Thanks.

Sincerely,
Everyone",wallstreetbets
2022-08-16 15:56:23+00:00,1559569772165087232,"PhD Analyst: Retail traders are done. They've all gone away and stopped participating.

Me: For summer vacation maybe, but school is back in session now.",wallstreetbets
2022-08-16 15:41:44+00:00,1559566084696690688,halted and halted,wallstreetbets
2022-08-16 14:39:40+00:00,1559550465448284160,"I'm man enough to admit I was wrong. Whenever I'm asked ""what's the next $GME?"" I reply that the markets are wise and won't allow another short massacre.

I was wrong.

$BBBY",wallstreetbets
2022-08-10 15:46:18+00:00,1557392905303498754,"@d3conomists @scottmelker more context in the full clip, but that's correct - at the time of the interview i didn't know yet.",wallstreetbets
2022-08-10 15:02:33+00:00,1557381895628804098,"How I got schooled by Luna.

Listen to the rest of the clip with @scottmelker (aka Wolf of All Streets)
https://t.co/sekvmeZszc https://t.co/p40rHJIGuw",wallstreetbets
2022-08-08 14:16:49+00:00,1556645611713298434,FOMO has been driving the stock rally since 1929. Bubble is bound to burst one century or another. https://t.co/7cUuUjAbK5,wallstreetbets
2022-08-08 14:11:49+00:00,1556644351693971458,@AristeguiOnline Shocking! Never saw that coming &lt;/sarcasm&gt;,wallstreetbets
2022-08-05 02:42:48+00:00,1555383791690063876,"Dear stock manipulator, please add a random() function in your bot to make it more believable.

$HKD price is $800.00 having lost $300.00 today and had a bid of $700.00 and ask of $850.00. I think I'll nope the fuck away from this. https://t.co/ag0xB0tvNp",wallstreetbets
2022-08-05 02:23:29+00:00,1555378930743377921,The most important thing a CEO can do to maximize shareholder value is securing a good ticker symbol.,wallstreetbets
2022-08-05 02:23:28+00:00,1555378926188470272,The real winner of the for AMTD Digital Inc run-up (ticker symbol $HKD) is the completely unrelated company with ticker $AMTD. https://t.co/jvAdPl2jHc,wallstreetbets
2022-07-27 14:11:46+00:00,1552295687806750722,"Is suing for celebrity endorsements a thing now? If so can we hit Diet Coke (Taylor Swift), Adidas (Beckham) and Charmin (Kardashian)? https://t.co/4h2UaVQKxk",wallstreetbets
2022-07-25 01:39:55+00:00,1551381700470513666,https://t.co/RwE3OLDPoV,wallstreetbets
2022-07-24 17:17:55+00:00,1551255370714210332,I heard Elon trademarked the term IDGAF and puts it to use on a daily basis. https://t.co/ng8CcWViTY,wallstreetbets
2022-07-23 03:00:37+00:00,1550677236289880064,https://t.co/0FDUI0Uvyn,wallstreetbets
2022-07-21 16:49:01+00:00,1550160931669295104,"@TeamYouTube I respectfully disagree.  Keep in mind that if you mean that somebody already has the google/youtube account called ""WallStreetBets"" then that person is also me... I should be able to claim my own username, right?

What can I do to fix this? Thanks!! https://t.co/Od0em50GkG",wallstreetbets
2022-07-18 23:34:35+00:00,1549175833641725953,@TeamYouTube https://t.co/CJRop9zFc5,wallstreetbets
2022-07-18 18:37:21+00:00,1549101032302489601,"@TeamYouTube can you help me with custom name for my channel? it says it's taken but it's clearly not (plus I own the ""wallstreetbets"" google account). I've cleared cache and followed random tips online but no luck. Thanks! https://t.co/IkcWZe4Cfz",wallstreetbets
2022-07-16 19:11:22+00:00,1548384816743079938,I wanna see stock options on a 4× leveraged single stock ETF. For science. https://t.co/m5MaNTGRlE,wallstreetbets
2022-07-16 19:06:25+00:00,1548383571890487299,"SEC is making it easier to gamble. Speaking of which, I've heard whispers of something the CME is cooking up to really take things to the next level! https://t.co/rGSTFa9rEt",wallstreetbets
2022-07-14 03:15:36+00:00,1547419512546402304,This week marks 8 years of sobriety for me. A brief reflection. https://t.co/WnOtOh5l46,wallstreetbets
2022-07-12 04:08:54+00:00,1546708150048391168,https://t.co/ku64R1FpH7,wallstreetbets
2022-07-08 22:33:38+00:00,1545536615124180992,"Yes, I'm in a place called Paradise. Aptly named. https://t.co/BKQJ9Erhgz",wallstreetbets
2022-07-08 04:31:48+00:00,1545264362713128961,"@lopezdoriga @nhk_news @eeWYTNa1QxcCudM wtf kinda ""gun"" is that? that's more like a cannon.",wallstreetbets
2022-07-06 00:06:49+00:00,1544472900643815427,@Four_Comma_Club It's got plenty of fuel. Just need to drop the dead weight before hitting the gas again.,wallstreetbets
2022-07-05 23:38:53+00:00,1544465870793031680,"I'll tell you when crypto bottoms out: as soon as those remaining who offer ""risk-free"" 20% APY go bust. 

That's when I'll be buying.  Along with all the healthy protocols/projects/cryptobanks who bought their distressed competitors for pennies.",wallstreetbets
2022-07-02 13:41:15+00:00,1543228309818880001,"The @wsj includes a helpful illustration:

don't peek and you won't to freak out. https://t.co/k1XYwqSJpI",wallstreetbets
2022-06-29 15:05:46+00:00,1542162415994998785,"@TheCoinDad There's lots, but my favorite so far is the BLVT. Essentially a 4x ETN but with variable leverage which mitigates the volatility decay problem.

Imagine buying 4x gold, except it doesn't go to zero in the long term.",wallstreetbets
2022-06-29 14:25:45+00:00,1542152346511327233,"There are two types of people in this world:

- those who think crypto is a bunch of coins with prices, meant to make you money

- and those who actually get it",wallstreetbets
2022-06-29 14:14:51+00:00,1542149602656370690,"From personal experience this isn't so bad. 

Just insert more money to play again. https://t.co/oFZY2xDtIc",wallstreetbets
2022-06-29 06:00:52+00:00,1542025285817745408,"@Shekhar551228 $0.005 maybe? No idea

I'm just enthralled by how *abandoned* stablecoin is having all the fun w/ mind blowing volume. No fucks given about sister LunaC and definitely not about the new &amp; improved V2 pair.

I can picture irony of it blowing past $1. And yes I know how it works",wallstreetbets
2022-06-29 04:35:47+00:00,1542003874613043200,"If an algorithmic stablecoin fails to hold its peg to the downside, what's to stop it from doging to the moon?",wallstreetbets
2022-06-29 02:08:01+00:00,1541966690258395140,USTC on track to $100 as a fuck you to everyone using on logic.,wallstreetbets
2022-06-28 22:31:49+00:00,1541912281222635520,"@WSJmarkets ""US makes gold more expensive, profitable for Russia.""",wallstreetbets
2022-06-28 22:09:05+00:00,1541906557428006912,"and by ""social media driven market volatility"" they mean ""high risk thumb traders that aren't afraid of margin calls""",wallstreetbets
2022-06-28 22:07:31+00:00,1541906166413942784,Better late than never I suppose. https://t.co/DUpjTY3AlW,wallstreetbets
2022-06-28 17:46:30+00:00,1541840477548417024,Update https://t.co/ZUdZHU77B3,wallstreetbets
2022-06-28 14:17:07+00:00,1541787786482696197,"@bennyretired Maybe it's news, or a typo, or it's people that look at the chart and ape into it without caring what it is. tbh I don't really care and threw some spare change at it anyways.

My Luna wounds made me immune to pain.",wallstreetbets
2022-06-28 14:06:53+00:00,1541785210060169216,In today's episode of WTF we have USTC... As in terra classic. https://t.co/y8bvs06HdV,wallstreetbets
2022-06-27 19:39:39+00:00,1541506565198385152,"@realDavidANappi I guess... But let's not pretend ""synthetic ethereum"" or ""algorithmic stablecoin"" is much better",wallstreetbets
2022-06-27 15:27:13+00:00,1541443036424482816,"I've always felt the word ""default"" should be used to describe payments made on time (otherwise it sounds like missing payments should be expected) https://t.co/JqGpV2g5F4",wallstreetbets
2022-06-26 05:07:57+00:00,1540924805280665600,"@ROTODAP 1. GameStop stuff happening. Lots of people signing up to Robinhood and is becoming hard to handle

2. Robinhood employee asks another if it's possible to slow down new accounts

3. Other employee says ""sure, by how many?""

4. Replies meme and says ""stop em all""",wallstreetbets
2022-06-26 05:03:22+00:00,1540923652660756480,Also a good reminder that anything you say in company emails can end up in congressional reports of public record.,wallstreetbets
2022-06-26 05:01:22+00:00,1540923148887015424,"You can't make this stuff up. Internal RH exchange during GameStop 

- RH Employee 1: Hey can we slow throttle down new customer account creation?

- RH Employee 2: Yeah, I guess it's possible. How much are we talking about throttling?

RH Employee 1: https://t.co/ClbwLGXMe8",wallstreetbets
2022-06-26 03:37:05+00:00,1540901937524219905,"Safe to say this tweet has aged terribly for me.

I'm a third of the way in and this report is capable of competing with JK Rowling. It's fucking hilarious, I'm hooked. https://t.co/4ylcirqIy7",wallstreetbets
2022-06-26 02:36:59+00:00,1540886815116120070,"@thebigdon27 I'm surprised you made it thru the whole thread without realizing that's sorta my point too.

But unlike previous crypto cycles that were based on isolated manias (eg beanie babies?), this one's based on stupidity only seen in systems that last a long time (like Wall St)",wallstreetbets
