Datetime,Tweet Id,Text,Username
2018-06-15 20:25:25+00:00,1007720756611084289,@ggad_ss @realDonaldTrump And he should.  The man deserves credit for a job well done.,wallstreetbets
2018-06-15 20:20:40+00:00,1007719562178105345,Thank you Mr. President @realDonaldTrump. You've corrected the problem. https://t.co/xof8q8Lecd,wallstreetbets
2018-06-14 12:24:15+00:00,1007237280950509568,Oddly satisfying https://t.co/zaQks3L0ci,wallstreetbets
2018-06-13 20:34:25+00:00,1006998244122025985,What time does the new Yellen announce the rate hike?,wallstreetbets
2018-06-12 01:48:19+00:00,1006352463526428672,"@WilDonnelly @TruthTeamOne It was right about here, give it take https://t.co/CMwG0Mb1CT",wallstreetbets
2018-06-11 21:55:36+00:00,1006293899336351746,"UPDATE: Dennis Rodman has arrived in Singapore to help broker the peace deal between Kim and Trump, sporting a shirt plugging his marijuana cryptocurrency. https://t.co/pe9qxsrGWa",wallstreetbets
2018-06-11 20:47:31+00:00,1006276767995138048,lol this upcoming summit should be spectacular https://t.co/TI2V0A1Yof,wallstreetbets
2018-06-11 20:44:52+00:00,1006276097799933952,Kim Jung Un has risen to the #1 spot for greatest troll alive. https://t.co/J6QI6qmDFn,wallstreetbets
2018-06-11 17:44:43+00:00,1006230762360733702,fx economic calendar warns of a news event coming up. https://t.co/9SEbXGFkM5,wallstreetbets
2018-06-08 12:45:52+00:00,1005068391130935298,"@anilvohra69 HAHAHAHAHAHAHAHAHAHAHA
no. MMs don't have voodoo secret magic powers, they're you and me. 
Go put some limit orders up on your broker with spreads of your choosing. Boom! If they fill you're a magic MM.",wallstreetbets
2018-06-07 23:09:14+00:00,1004862878254551041,"@anilvohra69 @ForexLive @mhewson_CMC lol wtf you talking about? ""market makers"" are subject to the same spreads on the other side of the trade.  if you're buying and selling, you're making markets -- whether you're algo trading on the renaissance's medallion fund or using e*trade from mom's basement.",wallstreetbets
2018-06-06 20:56:25+00:00,1004467067549085696,"Q: What's better than ATH?
A: Absolutely nothing.",wallstreetbets
2018-06-04 21:41:25+00:00,1003753616166014982,S&amp;P clearly jealous of Nasdaq returns. https://t.co/ljJNMIOP54,wallstreetbets
2018-06-04 19:54:25+00:00,1003726687610208258,On what day is Mueller's earnings release?,wallstreetbets
2018-06-04 16:50:56+00:00,1003680513595445248,May could be the best time to sell but June is the new time to buy.,wallstreetbets
2018-06-04 03:22:47+00:00,1003477137406472195,How can one get tickets to the Melania premier?,wallstreetbets
2018-06-02 20:59:55+00:00,1003018397125259264,@tylltt Link?,wallstreetbets
2018-06-02 20:55:37+00:00,1003017314441105408,@ImpeachHumanity @slangwise Get a room you two,wallstreetbets
2018-06-01 17:08:57+00:00,1002597883487584256,I called in about lulu FDs bois https://t.co/MXuM50J8gY,wallstreetbets
2018-06-01 16:50:19+00:00,1002593194029314050,"Alright, market seems to be doing well.  Cue the permabears coming out of their caves to bitch about why it's wrong that stocks go up.",wallstreetbets
2018-06-01 12:55:45+00:00,1002534162652250112,He was prolly front running some SPY calls. https://t.co/KjdLdLq9VM,wallstreetbets
2018-05-31 18:34:36+00:00,1002257049051426822,PROTIP: How to properly trade a range for free money. https://t.co/Y5SEawP2mE,wallstreetbets
2018-05-30 21:06:25+00:00,1001932868161912832,Who is Roseanne and why do the markets rally when she gets sacked?,wallstreetbets
2018-05-29 18:38:47+00:00,1001533325587120128,so much for the weekend plans... https://t.co/kd8onKGJ45,wallstreetbets
2018-05-29 17:25:28+00:00,1001514875082985478,"I recon today is bad day for bots as forex markets are completely lost with treasury yields in the shitter yet USD up, as is JPY with China tarrifs. EUR and GBP somehow locked in sync with on italy news.  MXN &amp; CAD down on broken nafta.  Correlations are dead (and crude is free)",wallstreetbets
2018-05-28 19:25:34+00:00,1001182713561395202,"Why is every website imaginable making people accept ""new"" privacy cookie monsters?",wallstreetbets
2018-05-25 15:51:57+00:00,1000041790542635010,fucker isn't even touching the VWAP(5) -&gt; going straight to $67 https://t.co/Bcb626UM4C,wallstreetbets
2018-05-25 15:48:37+00:00,1000040951891492864,https://t.co/nwq4qa7xuI,wallstreetbets
2018-05-25 15:44:37+00:00,1000039943639584768,"Fill up your gas tank for free today, courtesy of /CL",wallstreetbets
2018-05-23 19:13:29+00:00,999367732368818176,"Sell in May, they said.",wallstreetbets
2018-05-23 01:59:43+00:00,999107578306052096,Homeless man beats the cops at clearing a suspicious package. Gets arrested. https://t.co/QjGYJFLEpO,wallstreetbets
2018-05-20 00:32:30+00:00,997998464620376064,Juxtaposition https://t.co/5tvkbtEa7O,wallstreetbets
2018-05-19 02:45:33+00:00,997669561687130112,There have been more school shootings today than all of last week put together.,wallstreetbets
2018-05-15 00:43:57+00:00,996189407752306688,Lawmakers want to protect consumers &amp; only want you to gamble on Wall Street. Where you can safely sell naked weeklies on leveraged inverse volatility ETFs. https://t.co/oLjZS4glaL,wallstreetbets
2018-05-11 13:47:17+00:00,994936989068812289,One of these is not like the other https://t.co/p2WUZtgUlC,wallstreetbets
2018-04-28 14:49:49+00:00,990241683341275136,Somebody get these men some Segways https://t.co/wo9V16Tyvz,wallstreetbets
2018-04-24 05:54:26+00:00,988657398515576838,Credit to u/jacobcruzgarcia for a creative synopsis of WSB https://t.co/4mzTFmwIHP,wallstreetbets
2018-04-23 20:20:20+00:00,988512919410311174,You had exactly 0.32 milliseconds to make some money on $GOOG's 73% jump in EPS this quarter.  Happy hunting. https://t.co/BWTgbQRowT,wallstreetbets
2018-04-23 03:33:02+00:00,988259424946008064,#DebateINE https://t.co/jyK9kU8q0u,wallstreetbets
2018-04-23 02:36:05+00:00,988245092946264064,El Bronco is  the real hero Mexico deserves but not the one it needs right now.,wallstreetbets
2018-04-20 21:26:21+00:00,987442368398921729,@Stammy @b_dhokia When at-the-money S&amp;P options with a month to expiration turn into out-of-the-money options with only a week to expire. Translation: losing money and no time to recover.,wallstreetbets
2018-04-19 23:38:10+00:00,987113155586416642,Thanks Waze. I'll get right on it. https://t.co/WuyrZdQAcI,wallstreetbets
2018-04-16 20:14:32+00:00,985974747468042241,somebody did a thing https://t.co/hUQ0BZuVrS,wallstreetbets
2018-04-16 20:03:45+00:00,985972032541155328,lol https://t.co/XBto0ddeDs,wallstreetbets
2018-04-13 22:38:27+00:00,984923797638692865,The more you think about it the harder it is to disagree https://t.co/wgxZMe18O3,wallstreetbets
2018-04-12 21:28:54+00:00,984543907156504579,Get rid of it first. Ask questions later. https://t.co/pwZpPKa53R,wallstreetbets
2018-04-12 01:42:51+00:00,984245429121384448,All signs pointing to Trump shaking up the DOJ with some serious changes by EOY. Could trickle down some economics on short sellers.,wallstreetbets
2018-04-11 17:18:25+00:00,984118484530589703,"How to get rich with zero risk (unless it doesn't work as planned).  Sell the NQ 6,650 and pick it back up at 6,590.  Don't even bother with stops. https://t.co/Bx0BkYsDW0",wallstreetbets
2018-04-11 01:22:45+00:00,983877984577826816,They don't stand a chance on WSB. Home of the FDs. https://t.co/XMKS1zKHxv,wallstreetbets
2018-04-10 20:26:26+00:00,983803413560520704,This is great.  $FB ticker symbol overlaid on Zuckerburg testimony to grade his performance.  It would appear it's going well. https://t.co/6a6AHI1as9,wallstreetbets
2018-04-10 15:53:18+00:00,983734674739544064,Unpenetrable https://t.co/KBD81AQTrR,wallstreetbets
2018-04-09 20:32:02+00:00,983442433185865730,ADR without a doubt the best and only indicator there is. https://t.co/EEcudR2YnP,wallstreetbets
2018-04-09 18:42:40+00:00,983414909949087744,Chances we end the day in red are 70/70.,wallstreetbets
2018-04-09 18:32:38+00:00,983412384806076416,quite possibly the most respected channels https://t.co/u854zTJwNc,wallstreetbets
2018-04-08 17:33:39+00:00,983035155219542018,"@realDonaldTrump I don't get it. If he doesn't lose then you lose, right? How can there ever be an arrangement where everyone wins??",wallstreetbets
2018-04-05 03:07:12+00:00,981729943674544129,Ok @CNBC thanks for the update. https://t.co/Bgc5QBAlWT,wallstreetbets
2018-04-05 03:04:27+00:00,981729250163109889,@ForexLive 107.01,wallstreetbets
2018-04-04 22:14:02+00:00,981656163141013506,"@thiccwoj it appears so.  OP posted a bit of proof, but handwriting and personality seem to be a match.  https://t.co/kLfrv4Xs83",wallstreetbets
2018-04-04 22:02:21+00:00,981653222493433856,Martin Shkreli to do an AMA for WSB from jail.  Credit to u/Theriley106 for corresponding with convicted felons. https://t.co/QgeKtoEFak,wallstreetbets
2018-04-04 20:39:31+00:00,981632376915812353,Probably because it was offered in bitcoin https://t.co/b9shDH1Bi8,wallstreetbets
2018-04-04 20:39:11+00:00,981632293407281152,@david_j_roth Really? $50 for Jeff Bezos?,wallstreetbets
2018-04-02 20:35:52+00:00,980906685735886852,Dear @realDonaldTrump - you had ONE job. Please correct this. https://t.co/QEpdmaMjPF,wallstreetbets
2018-04-02 16:21:48+00:00,980842746184392704,On second thought it's entirely possible that 2018 is not the year to have bought the dip. https://t.co/1jyIxEdSxB,wallstreetbets
2018-04-01 02:10:14+00:00,980266054852034560,Reminding people to change their clocks for daylight savings is like reminding people to rewind their VHS before returning it to blockbuster.,wallstreetbets
2018-03-31 23:22:23+00:00,980223812280098816,"It's ok, it's still legal in the other 49. https://t.co/Q7pX2e4CCC",wallstreetbets
2018-03-31 05:19:47+00:00,979951368185069568,What is the net worth of the winklevi twins?,wallstreetbets
2018-03-29 22:00:53+00:00,979478527446847489,Bitcoin is easy. https://t.co/XvIDOXZYJI,wallstreetbets
2018-03-29 21:50:46+00:00,979475980489240576,This PF Chang's has a breathalyzer in case you got accidentally wasted while eating lettuce chicken wraps. https://t.co/ZfyizzTCV5,wallstreetbets
2018-03-29 19:51:43+00:00,979446020315729920,@ArchitectCrypto @altcointhoreau I didn't realize FB established themselves as a company that gives away free shit to users in return for privacy.,wallstreetbets
2018-03-29 02:00:40+00:00,979176482613354497,BREAKING: the stock market. it is breaking.,wallstreetbets
2018-03-28 01:29:28+00:00,978806244470329345,poor $TSLA the lonely stock today that took a dive because a car crashed. https://t.co/rQ7hAyzHc4,wallstreetbets
2018-03-23 04:58:43+00:00,977046963911720960,@BECKFX1361 @PipCzar What in god's good name is that chart?,wallstreetbets
2018-03-23 01:00:56+00:00,976987122304401408,@turbo_dingus They sure as hell did sell it. Perhaps not invoiced to CA with intended purpose to exploit electorate. Facebook users ARE the product they sell. They have no issues with apps / sites who use FB login to collect user info.,wallstreetbets
2018-03-22 21:49:14+00:00,976938879386136576,Being mad at FB for selling people's data is like being mad at Bacardi for selling Rum.,wallstreetbets
2018-03-22 20:18:58+00:00,976916162968612864,Remember when it comes to BTFD: The bigger the dip the bigger the dick. Happy hunting.,wallstreetbets
2018-03-22 19:06:30+00:00,976897929133801472,"Funds have redefined ""risk off"" to mean all-in on equities. Sitting in treasuries or cash dollars right now has been deemed too risky.",wallstreetbets
2018-03-22 16:12:42+00:00,976854189295984640,Mueller should interview Trump live on pay per view,wallstreetbets
2018-03-21 22:48:05+00:00,976591303419940864,BREAKING: Mueller investigating latest $BTC drop as well as self-driving Uber killer car.  Reports of him moving to craziness with March Madness next.,wallstreetbets
2018-03-18 18:22:27+00:00,975437292071522305,He collided with Americans to meddle in their election. Muller you have your work cut out. https://t.co/WwnxpgWyxO,wallstreetbets
2018-03-18 18:08:56+00:00,975433888003739650,Fuck da police https://t.co/bsnjXoxkhL,wallstreetbets
2018-03-17 22:28:31+00:00,975136827505020929,Fuck da police https://t.co/4YpzrJHxbF,wallstreetbets
2018-03-17 06:33:34+00:00,974896505428611073,"@QTRResearch Agreed $1k is a bit steep, but would you buy it for $900?",wallstreetbets
2018-03-17 01:13:55+00:00,974816065799692288,Pilot forgot his cellphone. Turned that bitch around. https://t.co/PAQGlY5xpM,wallstreetbets
2018-03-16 22:41:22+00:00,974777675301572608,"@Julian_V_L @jasanchezc @econokafka Si tan solo el gobierno fuera compuesto de ciudadanos mexicanos elegidos por otros mexicanos, ya no tendríamos estos problemas.",wallstreetbets
2018-03-14 05:41:48+00:00,973796315279888384,@MajorXpress That's some serious R right there.,wallstreetbets
2018-03-14 02:34:28+00:00,973749172716240896,lol #Rexit https://t.co/tO1oxVKPNV,wallstreetbets
2018-03-12 18:53:13+00:00,973270707927965699,@nelsonneuberger This is entirely possible but hard to confirm. Perhaps you can try manipulating your own posts with Javascript code to upvote other posts to counter the down brigade? Let the bots fight it out,wallstreetbets
2018-03-12 05:38:31+00:00,973070711446159361,Effective defense against radioactive 007 caliber spy poison is... a tide pod. https://t.co/KUXWKxCDX2,wallstreetbets
2018-03-11 19:56:03+00:00,972924132169043968,@tsutsukihogoshi Perfect. Thank you.,wallstreetbets
2018-03-11 19:26:13+00:00,972916621244293121,@tsutsukihogoshi Not to my knowledge. Please message the mods if you're having troubles,wallstreetbets
2018-03-11 16:04:38+00:00,972865891648983040,@HazzleDazzle81 Dunno. Probably down for maintenance.,wallstreetbets
2018-03-09 18:45:50+00:00,972181684396290048,Kim Jong Un was recently seen shopping for a new bag to use as nuclear football for his upcoming meet 'n greet with Trump. https://t.co/O9l2hneYSy,wallstreetbets
2018-03-09 17:58:22+00:00,972169740339748865,Free Martin fans spotted everywhere https://t.co/slraINeF6I,wallstreetbets
2018-03-09 17:47:02+00:00,972166885969092608,"Wishing Martin Shkreli - philanthropist, rap aficionado, hair collector and fellow WSB mod - good luck with his sentencing today.",wallstreetbets
2018-03-09 05:18:16+00:00,971978452717912067,@CNBC If you live in any of the five continents you should consider evacuating. Preferably to the ocean where it's apparently safe. https://t.co/5qcX6AhOrD,wallstreetbets
2018-03-09 02:38:18+00:00,971938194689114113,Inflation https://t.co/8ffGlsYIub,wallstreetbets
2018-03-09 02:15:04+00:00,971932350723403777,McDonald's should celebrate national men's day and leave their logo right side up,wallstreetbets
2018-03-06 23:12:07+00:00,971161534876569600,Dat gap https://t.co/wEjFSXTzAR,wallstreetbets
2018-03-05 14:17:00+00:00,970664480790102016,@AvaTrade 6382802,wallstreetbets
2018-03-04 16:36:03+00:00,970337085809831936,So by extension r/investing owns 7% of S&amp;P. And by contrast WSB owns all the options for $SPY. https://t.co/SunqocrLoK,wallstreetbets
2018-03-02 18:37:50+00:00,969642956121456640,"PROTIP: if you're planning on using @AvaTrade, you can save some time by wiping your ass with your money and flushing it down the toilet.  Otherwise you can open account, deposit real money, and trade it as if it was a demo account because they won't let you withdraw.",wallstreetbets
2018-03-02 05:01:04+00:00,969437411624198144,Cops should have looked for a school teacher and asked for help. Surely they're a better shot. https://t.co/E4ZMMYMc3t,wallstreetbets
2018-03-01 05:01:14+00:00,969075065013682176,#MeToo please? https://t.co/Rzt1a3RMgD,wallstreetbets
2018-03-01 04:53:36+00:00,969073142571286528,@paranoidbull FTFY https://t.co/nblxge9voJ,wallstreetbets
2018-03-01 01:20:42+00:00,969019564729102336,Whoever did AH trading is boring has never traded in 2018. https://t.co/kxSAIeCt8D,wallstreetbets
2018-02-28 23:52:23+00:00,968997338441109504,Same for the euro https://t.co/YKUeQSEK0t,wallstreetbets
2018-02-28 23:49:41+00:00,968996661170065413,Nothing on the left to catch it https://t.co/ycLx3IjtXn,wallstreetbets
2018-02-27 16:52:51+00:00,968529372209532928,"Dear @realDonaldTrump, we were expecting all time highs today and you failed. Please correct this.",wallstreetbets
2018-02-27 15:59:11+00:00,968515865766326272,@NorthmanTrader I stand corrected.,wallstreetbets
2018-02-27 15:54:11+00:00,968514608628576257,You're still permabearing after the most massive and rapid correction in history? https://t.co/c69g0Dy0Yt,wallstreetbets
2018-02-27 04:59:25+00:00,968349833085022208,@dailydirtnap *relative* drawdown... The $100 investment would have never been worth $20,wallstreetbets
2018-02-25 23:50:55+00:00,967909806559313920,@Moravid88 @joefriday_714 200d ma was being talked about by everyone from wsj to my next door neighbor. Just place a buy order on it and voila. Free money.,wallstreetbets
2018-02-25 23:48:47+00:00,967909271269617664,@_boates_ @marcorubio Depends who's asking. Who's asking?,wallstreetbets
2018-02-25 20:30:59+00:00,967859490329513984,"@joefriday_714 idk, that's a heck of a tail which on the daily has already retraced twice. Third time may not be as forgiving. https://t.co/ybn2W9zIqi",wallstreetbets
2018-02-25 03:51:46+00:00,967608030203297792,@spectatorindex @NellyRamirezM @JaqueRogozinski,wallstreetbets
2018-02-25 00:25:54+00:00,967556223527567360,This news is a year old: Mexican President Peña Nieto cancels trip to Washington https://t.co/j3n1DNzGqu https://t.co/YRZAL4f3F5,wallstreetbets
2018-02-24 16:10:03+00:00,967431436851490817,@_drobban Pretty much. iirc the lipstick theory is something about women whoring it up to attract suitable male with money during down cycles. Dgaf during booms.,wallstreetbets
2018-02-24 15:53:09+00:00,967427183340806144,OUTSQUARE yey another application of your whacky lipstick theory https://t.co/E3ApHFxLuU,wallstreetbets
2018-02-23 19:17:29+00:00,967116220100091904,@BrianThomasCox @thehill Yeah but he's literally the only one. Hate on the ones who aren't doing their job.,wallstreetbets
2018-02-23 14:49:00+00:00,967048652395921408,@thehill These students are doing a disservice to their cause. They need to stay on point and avoid ad hominems. Rubio was the ONLY politician to show his face which made him target. They should go after the politicians who are hiding instead.,wallstreetbets
2018-02-23 05:06:56+00:00,966902170011426816,UPDATE: the correct answer was B. Obviously. https://t.co/cuPrAz7YYL,wallstreetbets
2018-02-23 02:15:27+00:00,966859015027351554,"Hate him or love him, you have to respect @marcorubio for accepting the townhall event, which he knew would be hostile, and answer difficult questions on TV. Unfortunately he's getting crucified instead of applauded for opening up.",wallstreetbets
2018-02-22 21:23:02+00:00,966785425892405248,"PROTIP #14: If you're unsure about the impending move (fig 1), make a few more drawings until you find the one that agrees with your bias (fig 2 &amp; 3) https://t.co/hD26KAbkU0",wallstreetbets
2018-02-22 18:40:45+00:00,966744588118507520,The best way to get rid of guns is by forming a well regulated militia. Nothing  works better than having a government feel threatened by the people.,wallstreetbets
2018-02-22 05:05:26+00:00,966539405765763072,"Not so sure about that, with room and board, a 4 year Ivy League education could be a mistake https://t.co/boRPZiXLXA",wallstreetbets
2018-02-22 03:50:16+00:00,966520491316936705,@CNN @TruthTeamOne wtf is an NRA rating? Sounds like a bad thing but they have straight A's.,wallstreetbets
2018-02-22 03:44:37+00:00,966519067048755201,@MarketWatch Word is Steven Segal has a neat-o coin,wallstreetbets
2018-02-22 03:06:04+00:00,966509368492507139,Nope. You'll know they're over when little rocket man resumes intergalactic nuclear missile tests. https://t.co/PuGSr7Xw7W,wallstreetbets
2018-02-22 01:14:29+00:00,966481286557663232,"@chigrl QE has been unwinding since Bernanke back when the word ""taper"" was still cool.",wallstreetbets
2018-02-21 15:24:17+00:00,966332755733725184,Well who are you supposed to call if Col. Sanders doesn't pick up? https://t.co/iMbPqmmsfY,wallstreetbets
2018-02-21 03:09:49+00:00,966147921417654272,@FoxBusiness Wtf is cardano? It seems the bubble isn't the price of bitcoin but the sheer number of coins out there.,wallstreetbets
2018-02-21 03:07:56+00:00,966147449696890880,@RudyHavenstein You don't get rich enough to pay a 90k bar tab by over tipping.,wallstreetbets
2018-02-21 00:07:38+00:00,966102073732468737,Politicians beware: Any student protest which involves kids skipping school is bound to be wildly successful.,wallstreetbets
2018-02-20 21:50:59+00:00,966067686269632512,Yeah his twitter account could be confused for a WSB pleb. He is quite literally only pumping crypto. Sr. Presidente @NicolásMaduro me gustaría invitarlo formalmente a ser moderador de r/wallstreetbets en donde puede hablar sobre su criptomoneda. https://t.co/RcIEnmGwNG,wallstreetbets
2018-02-20 20:22:04+00:00,966045310396108800,What will come first?,wallstreetbets
2018-02-20 16:31:10+00:00,965987202596356102,In Russia even the sweepers dope up. https://t.co/HI836ysC5e,wallstreetbets
2018-02-20 06:01:33+00:00,965828751178256385,@Some_BlackGuy https://t.co/Zm58XRQGvP,wallstreetbets
2018-02-19 20:04:51+00:00,965678586689499136,A new tweet would have been inappropriate. Glad to see a reply to himself to stay on message. https://t.co/nSwxPFhldZ,wallstreetbets
2018-02-19 20:00:21+00:00,965677454332317697,"Back in the day, Twitter was used for actual revolutions like the Arab Spring et al. https://t.co/gPVv2dLote",wallstreetbets
2018-02-16 03:19:59+00:00,964338543618215936,This tweet aged well https://t.co/1jyIxEvtp9,wallstreetbets
2018-02-15 07:43:58+00:00,964042585219112960,EUR/USD trading like bitcoin https://t.co/hzVrxt1QiR,wallstreetbets
2018-02-14 03:05:34+00:00,963610137003884544,@o1park And look how the story ends with the final fake out below the line on the octilionth bottom. PS your Twitter account is quite possibly the worst on all of Twitter. https://t.co/SLh04hEFGG,wallstreetbets
2018-02-14 01:39:09+00:00,963588391873884160,How can we make 50 cent (not to be confused with the bitcoin/rapper) a WSB mod? https://t.co/civMhyGvxi,wallstreetbets
2018-02-14 01:26:16+00:00,963585149190336512,The world's strongest level. https://t.co/97NES2D7KO,wallstreetbets
2018-02-13 21:40:40+00:00,963528375254990848,Wouldn't have it any other way https://t.co/ZDN7O9NyxC,wallstreetbets
2018-02-10 15:02:19+00:00,962340960507064326,@ForexLive Second touch.,wallstreetbets
2018-02-09 22:18:11+00:00,962088261823811584,Who here remembers the TVIX snafu back in 2012? Credit suisse didn't learn,wallstreetbets
2018-02-09 20:20:13+00:00,962058575391506434,200d SMA. xoxo https://t.co/GH1GpD8j4G,wallstreetbets
2018-02-09 06:54:21+00:00,961855771523792898,"5 months after funding deadline, the US government is living hand to mouth on a monthly budget. https://t.co/PbKpm3L0Pb",wallstreetbets
2018-02-09 06:48:45+00:00,961854362917134338,"""Apparently $XIV caused the market to crash: Because it is a synthetic derivative that tracks the inverse of the implied volatility in the options for 500 stocks. So it's only logical for a decline in its price to cause worldwide fire sale of all equities"" - @jimcramer",wallstreetbets
2018-02-08 22:22:02+00:00,961726846625767424,https://t.co/iWJPwdCoxj,wallstreetbets
2018-02-08 22:18:11+00:00,961725875329712128,Guy accidentally makes 100k https://t.co/Mz75ratv2A,wallstreetbets
2018-02-08 22:00:42+00:00,961721477925027840,WSB traffic stats makes for more accurate fear gauge than the VIX,wallstreetbets
2018-02-08 21:45:15+00:00,961717590094577664,@RampCapitalLLC oops https://t.co/Bu2K2gFL4Z,wallstreetbets
2018-02-08 20:21:12+00:00,961696437561016320,VIX is clearly overbought.  RSI = 90.  Gonna sell some naked calls. https://t.co/HqVlRzP57Y,wallstreetbets
2018-02-08 05:13:14+00:00,961467938116132864,@NorthmanTrader Well to be fair the Chinese probably get a lot more bang for their buck than the US does.,wallstreetbets
2018-02-07 07:09:09+00:00,961134722666696705,@Moravid88 Secret council convenes on Tuesday to hold the final vote,wallstreetbets
2018-02-07 05:48:35+00:00,961114445232603136,Quite literally means you can't long inverse volatility as easy as before. https://t.co/xF4Pc71Yf7,wallstreetbets
2018-02-07 01:13:41+00:00,961045264273321984,Did everyone buy the dip?,wallstreetbets
2018-02-06 15:53:38+00:00,960904324141453315,@nanexllc But need to compare to normal days. Of course compared to yesterday liquidity will be lower,wallstreetbets
2018-02-06 04:27:22+00:00,960731618741837824,Risk-off doesn't really mean stop risking. It just means switch to risking on the other side of the trade.,wallstreetbets
2018-02-06 04:21:54+00:00,960730242850664449,"""leveraged volatility ETFs are sophisticated financial instruments used by investment funds for delta hedge..."" nigga please. Buy this shit if markets tank to make some bank. All you need to know.",wallstreetbets
2018-02-06 03:06:06+00:00,960711170285035520,When is Mueller supposed indict Trump? I wanna see what happens when we actually have a catalyst.,wallstreetbets
2018-02-06 03:00:18+00:00,960709711149531138,Those are 60 or so green bars on the left. 3 red bars on the right. https://t.co/zIDm4BUIzs,wallstreetbets
2018-02-06 02:55:29+00:00,960708497506750464,First touch. https://t.co/xBlByZZ2EZ,wallstreetbets
2018-02-06 02:53:10+00:00,960707913529593856,"Today's market move is just another tax cut for the wealthy (capital gains, that is).",wallstreetbets
2018-02-06 02:44:05+00:00,960705627483000832,Winklevi twins are no longer billionaires.,wallstreetbets
2018-02-06 02:41:11+00:00,960704899188166657,https://t.co/BSAsucQwh4,wallstreetbets
